{"$schema":"https://json-schema.org/draft/2020-12/schema","$id":"https://telemetryiq.local/schemas/operation/0.1.0","title":"TelemetryIQ operation record","type":"object","additionalProperties":false,"required":["schema_version","operation_id","session_id","provider","tool","category","outcome","provenance","provider_extensions"],"properties":{"schema_version":{"const":"0.1.0"},"operation_id":{"type":"string","minLength":1},"session_id":{"type":"string","minLength":1},"provider":{"type":"string","minLength":1},"tool":{"type":"string","minLength":1},"category":{"enum":["filesystem read","filesystem write","filesystem delete","shell command","network request","browser action","MCP call","source-control action","test execution","build execution","deployment action","unknown"]},"outcome":{"type":"string","minLength":1},"provenance":{"enum":["observed","inferred","unknown"]},"provider_extensions":{"type":"object"}}}
