{"schema_version":"0.1.0","operation_id":"op-001","session_id":"session-001","provider":"openai","tool":"codex","category":"MCP call","outcome":"success","provenance":"observed","provider_extensions":{"mcp_call":{"server":"filesystem","method":"list_directory"},"skill":{"name":"pdf"},"file_operation":{"path":"/tmp/out.txt","bytes":128}}}
