[
  {
    "schema_version": "0.1.0",
    "operation_id": "claude-code:synthetic-session-tools:tool:toolu_synthetic_bash",
    "session_id": "claude-code:synthetic-session-tools",
    "provider": "anthropic",
    "tool": "claude-code",
    "category": "shell command",
    "outcome": "success",
    "provenance": "observed",
    "provider_extensions": {
      "correlation": {
        "dedup_key": "claude-code:synthetic-session-tools:tool:toolu_synthetic_bash",
        "ordering_key": "01788718200100000000:claude-code:synthetic-session-tools:tool:toolu_synthetic_bash",
        "task_boundary": {
          "confidence": "unknown",
          "reason": "Claude Code tool_result telemetry has no reviewed task-boundary signal"
        }
      },
      "event": {
        "decision_source": "config",
        "decision_type": "accept",
        "duration_ms": 1234,
        "success": "true",
        "tool_input_size_bytes": 96,
        "tool_name": "Bash",
        "tool_result_size_bytes": 512,
        "tool_use_id": "toolu_synthetic_bash"
      }
    }
  },
  {
    "schema_version": "0.1.0",
    "operation_id": "claude-code:synthetic-session-tools:tool:toolu_synthetic_mcp",
    "session_id": "claude-code:synthetic-session-tools",
    "provider": "anthropic",
    "tool": "claude-code",
    "category": "MCP call",
    "outcome": "success",
    "provenance": "observed",
    "provider_extensions": {
      "correlation": {
        "dedup_key": "claude-code:synthetic-session-tools:tool:toolu_synthetic_mcp",
        "ordering_key": "01788718200300000000:claude-code:synthetic-session-tools:tool:toolu_synthetic_mcp",
        "task_boundary": {
          "confidence": "unknown",
          "reason": "Claude Code tool_result telemetry has no reviewed task-boundary signal"
        }
      },
      "event": {
        "decision_source": "hook",
        "decision_type": "accept",
        "mcp_server_scope": "project",
        "success": "true",
        "tool_input_size_bytes": 64,
        "tool_name": "mcp__synthetic-fs__read_file",
        "tool_use_id": "toolu_synthetic_mcp"
      }
    }
  },
  {
    "schema_version": "0.1.0",
    "operation_id": "claude-code:synthetic-session-tools:tool:toolu_synthetic_read",
    "session_id": "claude-code:synthetic-session-tools",
    "provider": "anthropic",
    "tool": "claude-code",
    "category": "filesystem read",
    "outcome": "failed",
    "provenance": "observed",
    "provider_extensions": {
      "correlation": {
        "dedup_key": "claude-code:synthetic-session-tools:tool:toolu_synthetic_read",
        "ordering_key": "01788718200200000000:claude-code:synthetic-session-tools:tool:toolu_synthetic_read",
        "task_boundary": {
          "confidence": "unknown",
          "reason": "Claude Code tool_result telemetry has no reviewed task-boundary signal"
        }
      },
      "event": {
        "decision_source": "user_temporary",
        "decision_type": "accept",
        "duration_ms": 12,
        "error_type": "Error:ENOENT",
        "success": "false",
        "tool_input_size_bytes": 48,
        "tool_name": "Read",
        "tool_result_size_bytes": 0,
        "tool_use_id": "toolu_synthetic_read"
      }
    }
  }
]
