[
  {
    "schema_version": "0.1.0",
    "operation_id": "codex:synthetic-sandbox-session:sandbox:synthetic-sandbox-call-failed",
    "session_id": "codex:synthetic-sandbox-session",
    "provider": "openai",
    "tool": "codex",
    "category": "shell command",
    "outcome": "failed",
    "provenance": "observed",
    "provider_extensions": {
      "correlation": {
        "dedup_key": "codex-log:6a214c0333501a7d48e3c52db190e72bbc3fde7c5f74be63a266b694afa2e409",
        "ordering_key": "01788717763631000000:codex-log:6a214c0333501a7d48e3c52db190e72bbc3fde7c5f74be63a266b694afa2e409",
        "task_boundary": {
          "confidence": "unknown",
          "reason": "Codex sandbox-outcome telemetry has no reviewed task-boundary signal"
        }
      },
      "log_attributes": {
        "call_id": "synthetic-sandbox-call-failed",
        "conversation.id": "synthetic-sandbox-session",
        "event.name": "codex.sandbox_outcome",
        "initial_duration_ms": "88",
        "model": "gpt-6-astra",
        "outcome": "failed",
        "tool_name": "exec_command"
      },
      "log_record": {
        "observed_time_unix_nano": "1788717763631000000",
        "severity_text": "INFO",
        "time_unix_nano": "1788717763631000000"
      },
      "resource_attributes": {
        "env": "telemetryiq-synthetic",
        "service.name": "codex_exec",
        "service.version": "0.153.4"
      },
      "sandbox_outcome": {
        "call_id": "synthetic-sandbox-call-failed",
        "category": "shell command",
        "initial_duration_ms": "88",
        "model": "gpt-6-astra",
        "operation_id": "codex:synthetic-sandbox-session:sandbox:synthetic-sandbox-call-failed",
        "outcome": "failed",
        "provenance": "observed",
        "tool_name": "exec_command"
      },
      "severity": "INFO"
    }
  },
  {
    "schema_version": "0.1.0",
    "operation_id": "codex:synthetic-sandbox-session:sandbox:synthetic-sandbox-call-success",
    "session_id": "codex:synthetic-sandbox-session",
    "provider": "openai",
    "tool": "codex",
    "category": "shell command",
    "outcome": "success",
    "provenance": "observed",
    "provider_extensions": {
      "correlation": {
        "dedup_key": "codex-log:686fda75c1b89d519893daabf5c31cd1bd4e84965609e281e89de3c8ce23fbd2",
        "ordering_key": "01788717763630000000:codex-log:686fda75c1b89d519893daabf5c31cd1bd4e84965609e281e89de3c8ce23fbd2",
        "task_boundary": {
          "confidence": "unknown",
          "reason": "Codex sandbox-outcome telemetry has no reviewed task-boundary signal"
        }
      },
      "environment": {
        "terminal_type": "synthetic-pty"
      },
      "log_attributes": {
        "call_id": "synthetic-sandbox-call-success",
        "conversation.id": "synthetic-sandbox-session",
        "event.name": "codex.sandbox_outcome",
        "initial_duration_ms": "123",
        "model": "gpt-6-astra",
        "outcome": "success",
        "terminal.type": "synthetic-pty",
        "tool_name": "exec_command"
      },
      "log_record": {
        "observed_time_unix_nano": "1788717763630000000",
        "severity_text": "INFO",
        "time_unix_nano": "1788717763630000000"
      },
      "resource_attributes": {
        "env": "telemetryiq-synthetic",
        "service.name": "codex_exec",
        "service.version": "0.153.4"
      },
      "sandbox_outcome": {
        "call_id": "synthetic-sandbox-call-success",
        "category": "shell command",
        "initial_duration_ms": "123",
        "model": "gpt-6-astra",
        "operation_id": "codex:synthetic-sandbox-session:sandbox:synthetic-sandbox-call-success",
        "outcome": "success",
        "provenance": "observed",
        "terminal.type": "synthetic-pty",
        "tool_name": "exec_command"
      },
      "severity": "INFO"
    }
  }
]
